{
  "schemaVersion": "0.2.0",
  "name": "DevEnvThreatCorpus",
  "updated": "2026-10-11",
  "modules": [
    "campaigns",
    "paths",
    "evidence",
    "sources",
    "behaviors",
    "frameworks",
    "mappings",
    "telemetry",
    "detections",
    "otel",
    "otel-reference",
    "governance"
  ],
  "campaigns": [
    {
      "id": "nx",
      "name": "Nx / s1ngularity",
      "kind": "Campaign",
      "date": "2025-08-26",
      "role": "Victim agent",
      "sourceIds": [
        "nx",
        "nx-step"
      ],
      "summary": "A compromised release connects CI credential theft, package execution and attempted use of local AI tools.",
      "limit": "Local AI use was attempted; the selected postmortem does not establish the success of each agent-mediated action. Actor identity is not asserted.",
      "admission": {
        "decision": "Include",
        "scores": [
          2,
          2,
          2,
          2,
          2
        ],
        "reason": "Anchor case named in chat; bridges CI supply chain and victim-side agent evidence.",
        "reviewStatus": "Unreviewed",
        "scoreOrigin": "LLM proposed admission score"
      },
      "pathIds": [
        "path-nx"
      ],
      "origin": "LLM synthesis",
      "reviewStatus": "Unreviewed",
      "reviewer": null,
      "enabled": true
    },
    {
      "id": "deadbugz",
      "name": "Deadbugz / productivity-suite",
      "kind": "Campaign",
      "date": "2026-08-10",
      "role": "Victim agent",
      "sourceIds": [
        "deadbugz"
      ],
      "summary": "A public delivery campaign exposes delayed malicious MCP definitions after ordinary tool use.",
      "limit": "Reviewed pull requests were unmerged at report time. The report confirms poisoned metadata, not successful credential theft on victims. Attribution is to a public delivery account only.",
      "admission": {
        "decision": "Include",
        "scores": [
          2,
          2,
          2,
          2,
          1
        ],
        "reason": "Named in chat; adds runtime gating and an explicit attempted-versus-confirmed distinction.",
        "reviewStatus": "Unreviewed",
        "scoreOrigin": "LLM proposed admission score"
      },
      "pathIds": [
        "path-deadbugz"
      ],
      "origin": "LLM synthesis",
      "reviewStatus": "Unreviewed",
      "reviewer": null,
      "enabled": true
    },
    {
      "id": "shai",
      "name": "Shai-Hulud / September wave",
      "kind": "Campaign",
      "date": "2025-09-15",
      "role": "Conventional malware",
      "sourceIds": [
        "shai"
      ],
      "summary": "A credential-stealing npm payload spreads using publishing privileges and adds repository persistence.",
      "limit": "This record models the September 2025 report. Shared behaviors with Nx do not establish common actor attribution. No AI-agent execution is asserted.",
      "admission": {
        "decision": "Include",
        "scores": [
          2,
          2,
          2,
          2,
          2
        ],
        "reason": "Supplemental StepSecurity seed adds propagation, branching and a published runtime-analysis reference.",
        "reviewStatus": "Unreviewed",
        "scoreOrigin": "LLM proposed admission score"
      },
      "pathIds": [
        "path-shai"
      ],
      "origin": "LLM synthesis",
      "reviewStatus": "Unreviewed",
      "reviewer": null,
      "enabled": true
    },
    {
      "id": "whatsapp",
      "name": "WhatsApp MCP sleeper",
      "kind": "Research exercise",
      "date": null,
      "role": "Victim agent",
      "sourceIds": [
        "whatsapp"
      ],
      "summary": "A controlled experiment shows one MCP integration steering actions of another trusted integration.",
      "limit": "A demonstrated attack primitive, not an observed campaign. The malicious server need not be invoked directly. Exact publication date is not verified.",
      "admission": {
        "decision": "Include",
        "scores": [
          2,
          2,
          2,
          1,
          2
        ],
        "reason": "Supplemental research cited by Pillar; provides a second example of delayed metadata poisoning.",
        "reviewStatus": "Unreviewed",
        "scoreOrigin": "LLM proposed admission score"
      },
      "pathIds": [
        "path-whatsapp"
      ],
      "origin": "LLM synthesis",
      "reviewStatus": "Unreviewed",
      "reviewer": null,
      "enabled": true
    },
    {
      "id": "gambit",
      "name": "Gambit / suspected ransomware affiliate",
      "kind": "Comparator",
      "date": "2026-06",
      "role": "Attacker agent",
      "sourceIds": [
        "gambit"
      ],
      "summary": "An operator used Claude Code while conducting remote intrusions; Case 1 is a scope comparator.",
      "limit": "Gambit assesses a suspected The Gentlemen affiliate with medium confidence. Its playbook combines multiple intrusions; not all steps occurred in every case.",
      "admission": {
        "decision": "Include",
        "scores": [
          2,
          2,
          2,
          1,
          1
        ],
        "reason": "Direct chat URL; clarifies which telemetry is outside the victim defender’s control.",
        "reviewStatus": "Unreviewed",
        "scoreOrigin": "LLM proposed admission score"
      },
      "pathIds": [
        "path-gambit"
      ],
      "origin": "LLM synthesis",
      "reviewStatus": "Unreviewed",
      "reviewer": null,
      "enabled": true
    }
  ],
  "paths": [
    {
      "id": "path-nx",
      "campaignId": "nx",
      "name": "Nx / s1ngularity attack path",
      "nodes": [
        {
          "id": "nx-1",
          "title": "Workflow injection",
          "detail": "A malicious pull request title executed commands in a privileged workflow.",
          "patternIds": [],
          "evidenceIds": [
            "nx-e1"
          ],
          "status": "Reported",
          "origin": "LLM source paraphrase",
          "reviewStatus": "Unreviewed"
        },
        {
          "id": "nx-2",
          "title": "Publishing token theft",
          "detail": "The attacker used a GitHub token to alter and trigger a workflow that exposed the npm token.",
          "patternIds": [],
          "evidenceIds": [
            "nx-e2"
          ],
          "status": "Reported",
          "origin": "LLM source paraphrase",
          "reviewStatus": "Unreviewed"
        },
        {
          "id": "nx-3",
          "title": "Malicious package install",
          "detail": "Poisoned Nx releases ran a postinstall payload.",
          "patternIds": [
            "install"
          ],
          "evidenceIds": [
            "nx-e3"
          ],
          "status": "Reported",
          "origin": "LLM source paraphrase",
          "reviewStatus": "Unreviewed"
        },
        {
          "id": "nx-4",
          "title": "Local AI invocation",
          "detail": "The payload attempted to launch installed Claude, Gemini and q with permissive CLI modes.",
          "patternIds": [
            "invoke"
          ],
          "evidenceIds": [
            "nx-e4"
          ],
          "status": "Attempt reported",
          "origin": "LLM source paraphrase",
          "reviewStatus": "Unreviewed"
        },
        {
          "id": "nx-5",
          "title": "Sensitive data collection",
          "detail": "The packages scanned user systems for sensitive data.",
          "patternIds": [
            "secrets"
          ],
          "evidenceIds": [
            "nx-e5"
          ],
          "status": "Reported",
          "atlasApplicability": "No AI-specific mapping: the source establishes package-level scanning, not agent-mediated credential retrieval at this step.",
          "origin": "LLM source paraphrase",
          "reviewStatus": "Unreviewed"
        },
        {
          "id": "nx-6",
          "title": "GitHub upload",
          "detail": "Collected data was uploaded to public GitHub repositories through the GitHub CLI.",
          "patternIds": [
            "repo-exfil"
          ],
          "evidenceIds": [
            "nx-e6"
          ],
          "status": "Reported",
          "origin": "LLM source paraphrase",
          "reviewStatus": "Unreviewed"
        }
      ],
      "edges": [
        {
          "from": "nx-1",
          "to": "nx-2",
          "label": "workflow escalation",
          "evidenceIds": [
            "nx-e1",
            "nx-e2"
          ],
          "basis": "LLM reconstruction from cited source sections; not a timestamped event trace or human-approved causal assertion.",
          "id": "path-nx-edge-1",
          "origin": "LLM inferred relationship",
          "relation": "sequence"
        },
        {
          "from": "nx-2",
          "to": "nx-3",
          "label": "poisoned publishing identity",
          "evidenceIds": [
            "nx-e2",
            "nx-e3"
          ],
          "basis": "LLM reconstruction from cited source sections; not a timestamped event trace or human-approved causal assertion.",
          "id": "path-nx-edge-2",
          "origin": "LLM inferred relationship",
          "relation": "sequence"
        },
        {
          "from": "nx-3",
          "to": "nx-4",
          "label": "optional agent invocation",
          "evidenceIds": [
            "nx-e3",
            "nx-e4"
          ],
          "basis": "LLM reconstruction from cited source sections; not a timestamped event trace or human-approved causal assertion.",
          "id": "path-nx-edge-3",
          "origin": "LLM inferred relationship",
          "relation": "conditional"
        },
        {
          "from": "nx-3",
          "to": "nx-5",
          "label": "payload collection",
          "evidenceIds": [
            "nx-e3",
            "nx-e5"
          ],
          "basis": "LLM reconstruction from cited source sections; not a timestamped event trace or human-approved causal assertion.",